[
  {
    "tool": "secretscan",
    "rule": "aws-key",
    "severity": "error",
    "path": "config/settings.go",
    "line": 12,
    "message": "possible AWS access key"
  },
  {
    "tool": "secretscan",
    "rule": "generic-token",
    "severity": "warning",
    "path": "deploy/env.sh",
    "line": 4,
    "message": "high-entropy string assigned to TOKEN"
  }
]
